Name,Address,Cuisine,Description,User_id,Photo
Pang's Kitchen,"Blk 451, Bukit Batok West Ave 6, Singapore 650451",Cuisine,"It's hard to decide what to try as everything seems to stand out in their own way. Their lok lok ($1 per stick) comes with a spread of intriguing sauces such as chinchalok, tom yum, mongolian onion and laksa. Those looking for a full meal should try the Seafood Combo ($18.80 for two pax) that can be cooked with three types of sauces: Signature, Nonya and Truffle Mushroom. They also have Poached Seafood Rice ($6.50) if you're on the pao fan wagon! Their small bites menu is nothing to sneeze at either and is filled with all sorts of deep-fried munchies like Fried Shishamo with Wasabi Mayo ($6), Crisp-Fried Marinated Pork ($6), Mala Crispy Fish Skin ($5.50) and Deep-Fried Oyster with Cajun ($5.50). 

Source: https://www.misstamchiak.com/pangs-kitchen/",,"https://res.cloudinary.com/yumssg/image/upload/c_fill,h_600,w_600/pangskitchen-6-1300x866_mw9oqk.jpg"
Mr Egg Fried Rice,"151 Bishan Street 11, #01-195, Singapore 570151",Cuisine,"No doubt this is awesome egg fried rice!
From the hands of Chef Yam / Mr. Egg Fried Rice
Superb chilli that you can buy too!
We had the signature pork chop egg fried rice + the special prawn tom Yam fried rice!

Source: https://www.facebook.com/groups/2773435079585801/posts/2982004082062232/",,"https://res.cloudinary.com/yumssg/image/upload/c_fill,h_600,w_600/245409199_10158866236097606_7996775001461636736_n.jpg_eif8xq.jpg"
New Station Snack Bar,"Far East Plaza, 14 Scotts Road, #05-95, Singapore 228213",Cuisine,"Best salted egg yolk pork ribs in Singapore.
One of our favourite food places at Far East Plaza is the New Station Snack Bar which is known for their famous salted egg pork ribs rice. 
Crispy and well-done pork ribs drenched in tasty salted egg yolk sauce; we love that the sauce is rich and extremely flavourful. This is one of the best salted egg pork ribs in Singapore. 
Pro tip: If you order the a la carte portion as a sharing dish instead of the individually portioned rice set, the pork ribs will come with a lot more sauce! And remember to add a fried egg to your rice.

Source: https://www.facebook.com/ladyironchef/posts/441535430671199",,"https://res.cloudinary.com/yumssg/image/upload/c_fill,h_600,w_600/245956947_441532770671465_1128293949910293442_n.jpg_itbmoa.jpg"
Nasi Lemak Ayam Taliwang,"Yishun Park Hawker Centre, 51 Yishun Ave 11, #01-33, Singapore 768867",Cuisine,"Ayam taliwang is named after the regency of Taliwang in Sumbawa Island where the sambal came from. Sumbawa is just east of Lombok Island which itself is east of Bali. In Lombok Island, ayam taliwang stalls are as ubiquitous as chicken rice in Singapore.

Source: https://johorkaki.blogspot.com/2021/10/nasi-lemak-ayam-taliwang-yishun-park.html",,"https://res.cloudinary.com/yumssg/image/upload/c_fill,h_600,w_600/AVvXsEggtJv1gYVVqp51xb4nuiYlmaIg9HYUs8wBM5bJaVqItmLIVCSR_mJziBKnLe_KNraQUvU3MY2PNJdiOZYkqAgTTI-cBB2gxCuGchCzQrp20b6ldVsX7O8HcU7rkcb3L5joJBGXsQ9ytrwqfw6421Kja4PsS8_6JR0ExduqBJC3IOf8VE3YGICdTjGa0g_w640-h480_xwojgr.jpg"
Joo Siah Bak Koot Teh,"Blk 349 Jurong East Avenue 1, #01-1215, Kai Xiang Food Centre, Singapore 600349",Cuisine,"With over 30 years of history, the Michelin Bib Gourmand stall offers Teochew-style BKT in a casual setting. Sink your teeth into the Prime Ribs Bak Kut Teh ($8.50), which features two long and meaty pork ribs steeping in a potent, peppery broth. Those who love braised meat should try their Pig Trotters ($5.50), which sits in a rich lor bak sauce that has been painstakingly boiled for hours.

Source: https://eatbook.sg/jurong-east-food",,"https://res.cloudinary.com/yumssg/image/upload/c_fill,h_600,w_600/joo-siah-bak-kut-teh-singapore_scemdu.jpg"
The Bread Gang,"235 Jurong East Street 21, Aiman Cafe, Singapore 600235",Cuisine,"The Bread Gang is a Muslim-owned hawker stall known for their cheese-drenched roti john, hearty burgers, and shareable sides at wallet-friendly prices. A classic is the Roti John ($6.50) with your choice of beef or chicken. If you prefer something different, there's also an extensive list of quesadillas and wraps to consider. For sides, check out the Beef Rendang Fries ($7.50) if you're up for something meaty, or go for the Cuban Pulled Beef Fries for an indulgent treat. 

Source: https://eatbook.sg/bread-gang/",,"https://res.cloudinary.com/yumssg/image/upload/c_fill,h_600,w_600/The-Bread-Gang-Flatlay_mrkeml.jpg"
Lai Heng Handmade Teochew Kueh,"347 Jurong East Avenue 1, #01-218, Yuhua Place, Singapore 600347",Cuisine,"They make their traditional Teochew kueh from scratch, and usually sell out by 2pm or earlier, so you should try to drop by as early as you can. Choose to get your kueh steamed or fried (top up $0.10); familiar favourites are the Png Kueh ($0.90/$1), Soon Kueh ($0.70/$0.80), and Chives Kueh ($0.70/$0.80).  

Source: https://eatbook.sg/jurong-east-food/",,"https://res.cloudinary.com/yumssg/image/upload/c_fill,h_600,w_600/lai-heng-teochew_nxo7ow.jpg"
Yew Tee Feng Zhen Lor Mee,"80 Jurong East Street 21, #01-05, Singapore 609607",Cuisine,"f it's your first time trying, get their Traditional Lor Mee ($6.50), which comes with toppings including fried meatballs, pork belly, and braised egg. Other variants include the Yuang Yang Fish Lor Mee ($7.50) and Crispy Chicken Cutlet Lor Mee ($6.50). 

Source: https://eatbook.sg/jurong-east-food",,"https://res.cloudinary.com/yumssg/image/upload/c_fill,h_600,w_600/WhatsApp-Image-2021-09-03-at-5.02.24-PM-e1630660322409_crboii.jpg"
King of Fried Rice (Jurong East),"132 Jurong Gateway Road, #01-271, Singapore 600132",Cuisine,"King of Fried Rice's Jurong East outlet is located in Happy Hawker Coffeeshop, which is a brief three-minute walk from the MRT station. 

They're most known for their signature Egg Fried Rice ($6.50), which comes with your choice of pork cutlet or shrimp, but if you're feeling adventurous, try their Mala Fried Rice ($7)  or Tom Yum Fried Rice ($7) for a spicy kick.

Source: https://eatbook.sg/jurong-east-food",,"https://res.cloudinary.com/yumssg/image/upload/c_fill,h_600,w_600/Sengkang-King-of-Fried-Rice-pork-cutlet-egg-fried-rice_plsz6r.jpg"
Beng Hiang,"135 Jurong Gateway Road, #02-337, Singapore 600135",Cuisine,"Open since 1978, this heritage restaurant is known for its old-school Hokkien delights such as Kong Ba Bao ($13.80+), alongside yummy modern dishes including Deep Fried Chicken Chop with Lychee ($18+), and Coffee Pork Ribs ($14+).

Source: https://eatbook.sg/jurong-east-food",,"https://res.cloudinary.com/yumssg/image/upload/c_fill,h_600,w_600/Jurong-East-Food-Beng-Hiang-1024x1024_qtqfec.jpg"
Koung's Wanton Mee,"50 Jurong Gateway Road, #B1-K14, JEM, Singapore 608549",Cuisine,"Originally located in Sims Avenue, the heritage wonton mee stall opened its second outlet just last year in the air-conditioned basement food hall in JEM. The casual eatery is most popular for its Wanton Noodle ($4.80/$5.80), available in both soup and dry.

What makes this stall stand out is its handmade wonton, house-made chilli sauce, and six-hour-roasted char siew. For sides, order some Fried Wanton ($4/$5) and Fried Ngoh Hiang ($5.80) to share! 

Source: https://eatbook.sg/jurong-east-food/",,"https://res.cloudinary.com/yumssg/image/upload/c_fill,h_600,w_600/Koungs-Wan-Tan-Noodles_kqm6xi.jpg"
D'Penyetz ,"50 Jurong Gateway Road, Jem,  #05-02 Singapore 608549",Cuisine,"Spicy food lovers should check out the famous Ayam Penyet chain D'Penyetz at Jem. The casual eatery imports its fiery sambal directly from Indonesia, offering you five spice levels from mild to dangerously spicy. On the menu are chicken, duck, fish, beef, and vegetarian options; signatures are the Ayam Geprek ($7.90) AKA smashed chicken, and Gado-Gado Surabaya ($7.50).

Source: https://eatbook.sg/jurong-east-food",,"https://res.cloudinary.com/yumssg/image/upload/c_fill,h_600,w_600/dpenyetz-1_guvqyc.jpg"
Qing Feng Yuan,"Tiong Bahru Market, 30 Seng Poh Road, Singapore 168898",Cuisine,"The blue cod really took me by surprise with its melt-in-your-mouth texture and delicate mouthful. It was also slightly sweeter than the usual batang fish that is normally used in fish soups, leaving me to conclude that the blue cod definitely zhnged-up what is known to us as an ordinary hawker affair. 

Source: https://eatbook.sg/qing-feng-yuan",,"https://res.cloudinary.com/yumssg/image/upload/c_fill,h_600,w_600/qing-feng-yuan-flat-lay-1_iuoyht.jpg"
Chao Yang Fishball Noodle,"Eunos Market, 4A Eunos Crescent, Singapore 402004",Cuisine,"Really good handmade stuff, nice bak poke, springy noodles and delicious fishballs. Mine is $3, but I would recommend you add ingredients so you can try their delicious her keow, meatballs and other handmade goodies. They're related to the Song Kee fishball noodles. 
They start selling at 530am and finish by 10am plus. Closed on Thursdays and Fridays. 

Source: https://www.facebook.com/groups/2773435079585801/posts/2980238958905411/",,"https://res.cloudinary.com/yumssg/image/upload/c_fill,h_600,w_600/246019498_10159926602256600_6624393148731710893_n.jpg_xfekou.jpg"
nosignboard SHENG JIAN,"1 Northpoint Drive #01-137/138 South Wing of Northpoint City, Singapore 768019",Cuisine,"The buns, which were pan-fried by the chefs at the front of the restaurant, came with crisp, golden bun bottoms while its finely pleated tops are soft and delicate, breaking apart to a gush of piping hot juices. Of the three, The Chili Crab and Pork one is a must-try where it perfectly incorporates the local favourite taste into Sheng Jian Bao.

Source: https://dairycream.blogspot.com/2021/10/nosignboard-sheng-jian-new-flagship.html",,"https://res.cloudinary.com/yumssg/image/upload/c_fill,h_600,w_600/AVvXsEinjgtZTVvHlkaLta8LitPX5U4oQYL7esasmPtuVn6S1JQ0HVJybjnh_3UR9KAIgBAnVoBQ1lFicaJVvVufTGEFsRA1WhboBKTetW7q0TPiyxhMYgguPCpeWynReMjKQ9eaXZ50pLGrV2ZEcn2oPm5cl4wH2b_4LHPIFXUQGtIsuLqeYbmq_cw0tVVC_w568-h640_xfexcp.jpg"
Xiang Cheng Shao La,"Food Paradise, Blk 182 Woodlands Street 13, Singapore 731182",Cuisine,"Melt in your mouth delicious char siew and roasted pork with light and crispy crackle. We had the flavoured rice (æ²¹é¥­) which had an aromatic pandan flavour and was not too oily.

Source: https://www.facebook.com/graceymommygoodeats/posts/121561403593301",,"https://res.cloudinary.com/yumssg/image/upload/c_fill,h_600,w_600/245949126_121561363593305_4534744093421860533_n.jpg_w4olzz.jpg"
Nam Kok Fishball Noodle,"Block 5 Jalan Minyak, Singapore 161005",Cuisine,"Teochew Kiaw, with a strong hint of Ti Po that goes very well with Mee Kia dry.

Source: https://www.facebook.com/groups/2773435079585801/posts/2978565159072791/",,"https://res.cloudinary.com/yumssg/image/upload/c_fill,h_600,w_600/245917278_4650631784960935_1348117949572914462_n.jpg_rwz8tz.jpg"
Paradise Briyani SG @ Sembawang Cottage,"369 Sembawang Rd, #01-07, Singapore 758382",Cuisine,"At paradise briyani, basically they offer mutton, chicken, prawn and even beef cooked in bamboo which is cooked over fire and then bamboo is served by pouring out all rice and ingredients using a stick inserting at the back of bamboo to push rice out. The aroma is unbeatable emitting from the hot steam released from bamboo. 

Source: https://www.facebook.com/groups/yumslist/permalink/1538210146515113/",,"https://res.cloudinary.com/yumssg/image/upload/c_fill,h_600,w_600/245750961_10159323361746226_7840803909839959316_n.jpg_ugemsm.jpg"
Feng Xiang Bak Kut Teh,"144 Upper Bukit Timah Road, #04-65, Beauty World Centre, Singapore 588177 ",Cuisine,"Out of the many fried porridge options presented to me, I went for one of the recommended ones on the menu: Sliced Fish Fried Porridge ($6.90). The piping hot dish was still gently bubbling and emitted a wonderful, smoky fragrance. It came topped with large pieces of lard, dried cuttlefish, fried shallots and spring onions for an extra boost of umami. 

The Herbal Bak Kut Teh (Soup) ($6.90 for small, $11.90 for medium) was a bubbling claypot of ingredients simmering in an aromatic broth that had seen long hours of brewing with quality herbs, ingredients and zero MSG. 


Source: https://www.misstamchiak.com/feng-xiang-bak-kut-teh/",,"https://res.cloudinary.com/yumssg/image/upload/c_fill,h_600,w_600/51576418244_9c0cbbc2a4_o_beit06.jpg"
Lokä¸Lok Bistro,401 Macpherson Rd #01-21 S368125 ,Cuisine,"Highly addictive loklok! All homemade sauce, love their chilli. They have soju + beer + loklok. :)

Source: Direct Submission by Jadyn",,"https://res.cloudinary.com/yumssg/image/upload/c_fill,h_600,w_600/inbound6280878685739073735_aw4auc.jpg"
Boon Cafe,"ITE College Central, 2 Ang Mo Kio Dr, Blk F, #02-11/12, Singapore 567720",Cuisine,"Menu items vary from Western ($6 - $9), Build Your Own Bowl ($5 - $8), Wanpaku Sandwich ($4), All Day Breakfast ($5 - $7) to an assortment of in-house pastries.

Only two dishes are available for their All Day Breakfast: Sweet ($5) served with a pancake and Savory ($7) served with slices of country loaf.

Source: https://danielfooddiary.com/2021/10/06/booncafesg/",,"https://res.cloudinary.com/yumssg/image/upload/c_fill,h_600,w_600/booncafe6_t52so2.jpg"
The Neighbourwok,"207 Bukit Batok Street 21, Singapore 650207",Cuisine,"I'll cut to the chase: this was divine. Cue every word in the dictionary that is synonymous with ˜spectacular'. For starters, the wok hei was certainly present yet not too overpowering, which I greatly appreciated. It allowed for the rich prawn stock to come through and rise to the occasion.

The supporting cast consisted of pork belly bits, sotong, prawns, the glorious crunchy pork lard, and sambal chilli made in-house. They all deserve honourable mentions in delivering nothing but pure, unadulterated deliciousness.

Source: https://sethlui.com/the-neighbourwok-singapore/",,"https://res.cloudinary.com/yumssg/image/upload/c_fill,h_600,w_600/The-Neighbourwok-7_oju8uj.jpg"
Hakka Yong Tau Foo,"Gar Lok Eating House, 217 Syed Alwi Road, Singapore 207776",Cuisine,"More than tasty on their own, the noodles came alive with the addition of Mr Chia's spicy, homemade chilli sauce, which was an absolute flavour bomb. He informed me that they fried up a batch every fortnight, using chilli, garlic and hae bee (dried shrimp).

Then, referring to the yong tau foo, he said: We make everything using quality ingredients. Our suppliers make their deliveries from 1am every morning and we start making it from 2am. It's hard work to hand-make each piece, so we can only serve a limited number. Nothing is kept overnight because we make fresh daily.

Source: https://cnalifestyle.channelnewsasia.com/dining/best-local-food-singapore-hakka-yong-tau-foo-syed-alwi-road-258671",,"https://res.cloudinary.com/yumssg/image/upload/c_fill,h_600,w_600/hakka-yong-tau-foo-syed-alwi-road-little-india-makan-kakis-cna-lifestyle_ffko8z.jpg"
Singapore Prawn Noodle,"1 Bukit Batok Crescent, WCEGA Plaza, Singapore 658064",Cuisine,"The Pork Rib Prawn Noodle ($4.50/5.50) is quite the hearty dish ” bursting with ingredients and flavour. The yellow noodles were coated with a savoury sauce that had a tingling spiciness which  lingered in ny mouth as I made my way through the bowl. There were also zero hints of that sharp alkaline taste from the noods, which got my immediate approval. 

Source: https://www.misstamchiak.com/singapore-prawn-noodle/",,"https://res.cloudinary.com/yumssg/image/upload/c_fill,h_600,w_600/51535484269_0fff2856e6_o_stabbo.jpg"
Kok Kee Wonton Noodle,"630 Ang Mo Kio Ave 4, #01-972, Singapore 560630",Cuisine,"Kok Kee is one of the popular wonton noodles stall in Singapore. After being acquired, they are expanding quickly and has opened their latest outlet in Ang Mo Kio.

Source: https://www.facebook.com/groups/yumslist/permalink/1536774283325366/",,"https://res.cloudinary.com/yumssg/image/upload/c_fill,h_600,w_600/245277748_4413509488744933_4766932125008444707_n.jpg_x5awps.jpg"
Pizza Pazza,"370 Alexandra Rd, B1 of Anchorpoint Shopping Centre, Singapore 159953",Cuisine,"This has to be one of our family's favourite #foodcourt #italianfood . Prices has been kept reasonable over the years and quality of food always consistently good. Today we had the 12"" thin crust #bbqpizza ($14.80) which was filled with chicken pieces, mushrooms and capsicums. We ordered 3 of their popular pastas ($8 each), #pennebuongustaio, #crispelledispinaci and #greenmussels #arrabiata . Their pizzas and pastas are very well done at this stall but if you're like me and need my greens, then try their #chickenceasarsalad ($6.50) as well. We ended up packing away the pizza cos everyone was too full. ðŸ˜…

Source: https://www.facebook.com/graceymommygoodeats/posts/119971507085624",,"https://res.cloudinary.com/yumssg/image/upload/c_fill,h_600,w_600/245157932_119971380418970_210743555317175204_n.jpg_vivfgc.jpg"
Jian Zao Ipoh Curry Noodles,"BLk 332 Ang Mo Kio Ave 1, Singapore 560332",Cuisine,"Ipoh Curry Noodles
Been patronising this stall for quite sometime
Broth is very flavourful and also they're very generous with their servings. One of the better or best Curry Mee in Ang Mo Kio area!

Source: https://www.facebook.com/groups/2773435079585801/posts/2974134506182523/",,"https://res.cloudinary.com/yumssg/image/upload/c_fill,h_600,w_600/244013197_1076028566536538_3836049904073833178_n.jpg_vlnhgj.jpg"
Hock Ann Confectionery,"46-3 Commonwealth Drive, #01-392, Singapore 140463",Cuisine,"One peek at Hock Ann Confectionery's baking station, and it's clear that nothing much has changed at the bakery in the past 35 years. It's amazing that Uncle Lee has managed to preserve the authenticity of his work through time-tested methods of baking, while maintaining the quality and appeal of his bakes over the years.

I'd definitely make multiple trips down to visit the bakery and soak in the nostalgic vibes, before Uncle Lee moves to a new location in December.

Source: https://eatbook.sg/hock-ann-confectionery",,"https://res.cloudinary.com/yumssg/image/upload/c_fill,h_600,w_600/Hock-ann-confectionery-store-front-1024x683_uvj61s.jpg"
IMM Staff Cafeteria,"IMM Building, #04-09, 2 Jurong East Street 21, Singapore, SG 609601",Cuisine,"IMM Building
(Use car park lift nearest to Best Denki or traveller near Giant or Daiso)
Super shiok mee rebus!  Shiok is actually an understatement to describe the taste.
Have not had such yummilicous mee rebus in a long time. 

Source: https://www.facebook.com/groups/2773435079585801/posts/2972509543011686/",,"https://res.cloudinary.com/yumssg/image/upload/c_fill,h_600,w_600/244667857_5100002853348610_6433981995932300710_n.jpg_crz0rc.jpg"
Satay Lok Lok,"Blk 22 Sin Ming Road, Singapore 570022",Cuisine,"This loklok CAN EAT!
Run by young hawkers at Blk 22 Sin Ming Road. Their loklok is more to the chili spicy based. Their chili really have a good kick.
They have all the usual loklok items, but also have alot of different items with other loklok stall. Have different types of cutlets, there is a good seafood roll too. 
They currently also have a Thai Honey Chicken Skin, very much different with the usual cripsy salted egg chicken skin we eat. This is more chewy, abit sweet & spicy. Very nice flavours.
They serve satays & thai grilled mooping too. All is charcoal grilled. Smokey nice ðŸ‘

Source: https://www.facebook.com/groups/2773435079585801/posts/2973466006249373/",,"https://res.cloudinary.com/yumssg/image/upload/c_fill,h_600,w_600/244965944_525144795341150_6777579142720339980_n.jpg_icvp10.jpg"
Xing Long Fish Soup,"Block 44 Bendemeer Road, Singapore 330044",Cuisine,"It's worth a try. Thumbs up

Source: https://www.facebook.com/groups/yumslist/permalink/1532781153724679/",,"https://res.cloudinary.com/yumssg/image/upload/c_fill,h_600,w_600/240594065_10160261058903492_4777521707892525983_n.jpg_nmcdr1.jpg"
Sing Hon Loong Bakery,"4 Whampoa Drive Singapore, Singapore 327715",Cuisine,"Traditional Bakery @ Whampoa. Super power, run 24 hours. 
Sell a few types of bread only, mostly is the white bread (think they supply to others too, alot van come & pickup)
Went at around 10.30pm, first time eat freshly come out curry bun!!! Piping hot out from the oven. Uncle still say need let it rest awhile, else it won't shape up and is too hot.
Had it after a few mins, its still too hot but super shiok!! 
The bread (had it when its cold, its like normal bread) taste between like prata & bread. Good amount of super hot filling ðŸ˜„ not everyday everywhere have chance to eat curry bun at this phrase and its only $1 ðŸ˜Š

Source: https://www.facebook.com/groups/2773435079585801/posts/2970986136497360/",,"https://res.cloudinary.com/yumssg/image/upload/c_fill,h_600,w_600/244328810_522960245559605_4711189883483351119_n.jpg_epvtk2.jpg"
Xinghua Delights,"7 Jalan Legundi, Singapore 759272 (Opposite Sembawang Shopping Centre)",Cuisine,"I think All Xing Hua food are flavourful and delicious. As most of us tasted these food I am not going to review as each has its own taste.

Source: https://www.facebook.com/groups/2773435079585801/posts/2970963623166278/",,"https://res.cloudinary.com/yumssg/image/upload/c_fill,h_600,w_600/240586308_261709525886013_7548444745451358135_n.jpg_ty4zqv.jpg"
Num Hiam Hainanese Curry,"People's Park Hawker Centre, 32 New Market Road, Singapore 050032",Cuisine,"Today lunch - 
Dabao curry rice ; generous portion of pork chop + braised egg+cabbage at $3.50 per box,  stewed pork rice(lu rou fan)$3.50, chicken cutlet set meal rice $5.00
All can eat.

Source: https://www.facebook.com/groups/2773435079585801/posts/2970481836547790/",,"https://res.cloudinary.com/yumssg/image/upload/c_fill,h_600,w_600/243120667_10225625348761908_8749321675596021498_n.jpg_qwmt5t.jpg"
BLYS Banh Mi Baguette,"Blk 132 Jurong Gateway Road, #01-277, Singapore 600132",Cuisine,"Two of us paid $3.00 each for eggs and chicken sandwich.. partner said ok can eat.. all warm and crispy.

Source: https://www.facebook.com/groups/2773435079585801/posts/2970461849883122/",,"https://res.cloudinary.com/yumssg/image/upload/c_fill,h_600,w_600/244257783_4014056832033548_2447177172066172951_n.jpg_uugt1o.jpg"
Crispy Prata,"350 Ubi Ave 1, Singapore 400350",Cuisine,"Crispy prata indeed! They serve square prata kosong here without hand slapping process. The result is a crispy crust, heavily ghee infused prata. Not for the faint hearted. They gave us veggie curry, dahl today. Forgot to ask for fish curry. 
I like the crispiness of the prata, but felt that the usual floury or doughy taste has been masked by the heavy use of ghee (clarified butter). 

Busy busy stall, long waiting time on a Sunday morning. 

Source: https://www.facebook.com/groups/2773435079585801/posts/2969738069955500/",,"https://res.cloudinary.com/yumssg/image/upload/c_fill,h_600,w_600/242963879_10158625555520945_7706249169806565247_n.jpg_dhnlqa.jpg"
Dessert Station,"Albert Centre Market & Food Centre, 270 Queen Street Albert Centre, Singapore 180270",Cuisine,"Dessert Station. My go to place for a comforting bowl of tau suan. The right sweetness and texture at only $1.50.

Source: https://www.facebook.com/groups/yumslist/permalink/1530050173997777/",,"https://res.cloudinary.com/yumssg/image/upload/c_fill,h_600,w_600/243048791_10160362343644252_5049794283811800183_n.jpg_fvo8wx.jpg"
Hong Style Fried Rice,"Blk 332, Ang Mo Kio Ave 1, Johnson Eatery, Singapore 560332",Cuisine,"Almost like Din Tai Fan. We liked the pork chop and the prawns also not bad. The sambal chilli is very nice. The eggs are well coated to the rice.
Simple stall with 3 types of fried rice.

Source: https://www.facebook.com/groups/2773435079585801/posts/2969120250017282/",,"https://res.cloudinary.com/yumssg/image/upload/c_fill,h_600,w_600/240506503_260142976042668_2170450346530505887_n.jpg_gg77yw.jpg"
Chef Hainanese Western Food,"Tanglin Halt Food Centre #01-04, 1A Commonwealth Drive, Singapore 141001",Cuisine,"Tender and well-marinated meat with a subtle grilled taste and a citrusy tang from the sauce. Old-school flavours, generous portion, the only thing holding me back is the long queue and longer wait.

Source: https://danielfooddiary.com/2021/02/24/tanglinhalt/",,"https://res.cloudinary.com/yumssg/image/upload/c_fill,h_600,w_600/tanglinhalt30_jle6fz.jpg"
Wei Yi Laksa & Prawn Noodle,"Tanglin Halt Market #01-20, 48A Tanglin Halt Road, Singapore 142048",Cuisine,"At 2am, Mr Yin is already at his stall, beginning preparations for the day. Chilli paste, boiling chickens - these are some of the things Mr Yin has to accomplish before business starts at 5.30am.
A bowl of Laksa can contain prawns, cockles, and chicken as toppings, depending on what one would like. Pieces of Tau Pok  soak up the thick, rich coconut-ty broth, that burst with flavour in your mouth. Noodles, submerged and coated with broth, will make you find yourself slurping non-stop,  savour with utmost delight!  
When asked about his  secret recipe for success, Mr Yin shared it is none other than putting heart and soul into the work you do!
Operating hours: 5.30am - 12.30pm; closed on Mon, Thu, Fri

Source: https://www.facebook.com/groups/2773435079585801/posts/2969140296681944",,"https://res.cloudinary.com/yumssg/image/upload/c_fill,h_600,w_600/242854119_391510582486619_8421977673118487222_n.jpg_y2e1vg.jpg"
Man Wu Lok Lok,51 Old Airport Road #01-85,Cuisine,"Very crispy and the seasoning is great! They sell Garlic Butter Rice too. 

Source: Ashton",,"https://res.cloudinary.com/yumssg/image/upload/c_fill,h_600,w_600/E9A8DA03-B3FC-406C-97A2-15A7E2DDC489_ayowji.jpg"
