Name,Address,Cuisine,Description,User_id,Photo
Two Men Bagel House,"16 Enggor Street, #01-12 Icon Village Extension, Singapore 079717",Cuisine,"For my Be(the)SM, the ingredients are ""house pork sausage, shitake shitake, sunny side up, grilled tomatoes, garlic kewpie"", and holding them together would be the everything bagel.

Frankly, it felt very much like I was digging into a burger; you can't go wrong with a sunny side up and whole shitake mushrooms (mushroom lover here), and I was absolutely in love with the house pork sausage that doesn't have the hot-dog look! Instead, it looked like a piece of spam with a softer texture and an added sweet tinge to its flavor. 

Source: https://cavinteo.blogspot.com/2021/11/two-men-bagel-house-icon-village-near-tanjong-pagar.html",,"https://res.cloudinary.com/yumssg/image/upload/c_fill,h_600,w_600/AVvXsEhx3S6xlwQN8HtFOb8YSpZEG4FkgeNqzKIV7Ziw9Ofp9ECEr7FCJTdFAnr-AoP3yIGRI0OSUgJvp_jUEbYfzgQKFwQgKQIjT8I2bBYEdJ3E2kty2xP5tTMIP5PwR7eEK6L3HfQGzzRoZnY84snCHKU_sNUDACgXGETwWlSPsPRlgHbIeHtRPQ_w640-h350_m1frdo.jpg"
Daruma Tavern,"25 Springside Green, #01-14/15, Singapore 786015",Cuisine,"We were very impressed by the thick Wok hey smell from their KL Dai Lok Mee ($7.9++). The KL Hokkien Mee totally blew us away with its smoky char wok hey aroma and punchy sweetness. No exaggeration, probably one of the best I've ever had.

The Hougang Six Miles Stone Fried Hokkien Mee ($7.9++) was equally shiok. I think it was from one of the closed hawker stalls as we learnt from Google. It's the very wet kind, topped generously with fresh crispy pork lard and full of oomph. Both dishes are totally worth the calories and must try. 

Source: https://dairycream.blogspot.com/2021/11/daruma-tavern-amazing-kl-hokkien-mee.html",,"https://res.cloudinary.com/yumssg/image/upload/c_fill,h_600,w_600/AVvXsEi8rXneDGzTNCwF4JlOm9yTilii4w0jaHdC80U5F5L0fDm7SGvAwBhSdI9Lr3ZiCxSVJXLWBdLwrZml1BGV3uCXYQuWFGaeRusIKUM15A9Cty0-TOyFNDujEM-OL9IBbUWTJl4jdZH-zCe2U7-L3WG1AaLsZWa-SSGUGZX0V4emc0B2AHbfsJvgRiLf_w640-h630_sinziq.jpg"
The Carving Board Grill,"Blk 252 Jurong East St 24, #01-107, Singapore 600252",Cuisine,"With its humble restaurant setting, The Carving Board Grill can serve up pretty atas Western food using higher quality ingredients while keeping prices more affordable for the local folk.

Source: https://sethlui.com/the-carving-board-grill-affordable-western-food-singapore/",,"https://res.cloudinary.com/yumssg/image/upload/c_fill,h_600,w_600/the-carving-board-7_xpkowk.jpg"
Reimondo Seafood Congee,"Pasir Ris Central Hawker Centre #02-07, 110 Pasir Ris Central, Singapore 519641",Cuisine,"Things started to unravel as I stirred up the content and scooped up one spoonful for a taste. Unlike typical Chinese congee, the flavor was unusual as it reminded me of Japanese miso soup. Two words; super nice!

Tucked within the congee included two fresh prawns and two scallops and bites of smoked salmon which not only gave a twist to the texture in every mouthful but also elevated the flavour.

Source: https://cavinteo.blogspot.com/2021/11/reimondo-seafood-congee-pasir-ris-hawker-centre.html",,"https://res.cloudinary.com/yumssg/image/upload/c_fill,h_600,w_600/AVvXsEgQ9F5NohBmCIPRvR3vu9Nt4tXvhbabbC5ZKoxwCjrNd5r6t32jAQr5rZgo1n1Z5QLAeghaqzGDY41oUWJHx4uUzqGN_4J_yN8wL3Vx7s4iWEIaDNJRIqX4thIsqpQZ3Z9X0S5uyfyufvJSjb7OUSSaWQpVNGYGIVg51x-BmLaIvnJRykGD4Q_w640-h306_pxkd8z.jpg"
Nanta BBQ,"Goldhill Plaza Mall 175 Thomson Rd, #01-175/177, Singapore 307624",Cuisine,"The cheese bbq chicken is soo good $46
We added the kimchi fried rice for $15 and the staff fried it for us after we are halfway thru the chicken. Again, it's really good. The staff is very friendly as well. 
Definitely be back to try the grilled meat, eyeing another table's food while I was eating ðŸ˜¬
The portion is good enough for 3 to 4 pax, even 5 if all small eaters.
The side dishes were top-up for free when asked ðŸ‘

Source: https://www.facebook.com/groups/yumslist/permalink/1558349941167800/",,"https://res.cloudinary.com/yumssg/image/upload/c_fill,h_600,w_600/248695733_10226042015533643_849832249203609747_n.jpg_ewrkx4.jpg"
Quan Ji Teochew Mee,"Bedok Interchange Hawker Center #01-44, 208B New Upper Changi Road, Singapore 462208",Cuisine,"Rarely can find such mee kia. Love the texture compared to the normal u mee. Taste is quite old school.

Source: https://www.facebook.com/groups/2773435079585801/posts/2998472890415351/",,"https://res.cloudinary.com/yumssg/image/upload/c_fill,h_600,w_600/255137721_10159566622543629_761028371145420837_n.jpg_d1jhpd.jpg"
Loong Fatt Tau Sar Piah,"639 Balestier Road, Singapore 329922",Cuisine,"Loong Fatt  specialises in Tau Sar Piah and is famous for their Salty and Sweet Tau Sar Piah at $1 each. They are well loved for their buttery, thin and crispy crusts filled generously with moist bean paste fillings.

Definitely one of the best in Singapore!

Source: https://www.instagram.com/p/CWFJhGtPKQo/",,"https://res.cloudinary.com/yumssg/image/upload/c_fill,h_600,w_600/250907290_10158084809690876_3265155946908690273_n.jpg_tnu7yp.jpg"
Don LechÃ³n,"511 Guillemard Rd, #01-52, Grandlink Square, Singapore 399849",Cuisine,"You know the food is good when the shop's location is hole in a wall but they have no lack of fans. While we were there, we saw many Filipinos, so we know the food must be very authentic. 

We had the shop's specialities, the chopped lechon rice set ($10) and the lechon sisig ($10). The super crispy skin for the chopped lechon complimented the vinegary sauces really well, totally cut thru the fattiness. The lechon sisig was a delicious combination of chopped meat, onions, red and green chillies plus a sunny side up served on a hotplate. Truly a meaty enjoyment!

Source: https://www.facebook.com/graceymommygoodeats/posts/127712609644847",,"https://res.cloudinary.com/yumssg/image/upload/c_fill,h_600,w_600/251445305_127712552978186_1591324623206642177_n.jpg_hfghq3.jpg"
Island Penang Kitchen,"721 Clementi West Street 2, #01-126, Singapore 120721",Cuisine,"My favourite among the 3 mains we ordered is the Penang Hokkien Prawn Noodle with Pork Rib ($7). The robustness of the prawn broth, with a hint of spiciness was balanced and work harmoniously with the different ingredients and noodles. In the bowl, you will get half an egg, kang kong, prawns, lean pork slices, pork ribs and pig skins. The pork rib was so soft that it literally melted in your mouth. What surprises me is the addition of pig skin in the bowl of noodle, this is a bonus to me.

Source: https://www.sgfoodonfoot.com/2017/09/island-penang-kitchen-clementi-west.html",,"https://res.cloudinary.com/yumssg/image/upload/c_fill,h_600,w_600/37062699526_1a005508c9_b_kyi27x.jpg"
Yan Ji Seafood Soup,"4 Woodlands Street 12, #01-26, Marsiling Mall, Singapore 738623",Cuisine,"They've been touted as one of the best seafood soup stalls in Singapore with over three decades of history. Their secret, according to the write-ups plastered across their storefront, is a slow and meticulous cooking process that infuses their soup base with the rich flavours of seafood.

Their menu is rather straightforward. If you love customising your meals, you can order their basic Seafood Soup ($6.50/$8.50/$10.50/$12.50), and add ingredients such as scallops, clams, and abalone as desired. Alternatively, just get the family-sized Premium Seafood Soup ($30) for a mix of all their seafood items.

Source: https://eatbook.sg/yan-ji-seafood-soup/",,"https://res.cloudinary.com/yumssg/image/upload/c_fill,h_600,w_600/Yan-Ji-Seafood-Soup-Crayfish-Soup_rudadn.jpg"
Tapas Club,"78 Airport Blvd. #03-220/221/222 Jewel Changi Airport, Singapore 819666",Cuisine,"The restaurant presents a very focused food menu with less than 50 items from cold cuts to desserts.

The dÃ©cor of the restaurant is a blend of modern and traditional with a Spanish flair. You can't miss the signature clay flowerpot, the flamenco logo and the robust passionate red colour representing Spain. The service is friendly and efficient.

Food & Drink: 7.5/10
Value: 7.5/10
Service: 7/10
Ambiance: 7.75 /10
Budget per Person: $26 - $50

Source: http://www.chubbybotakkoala.com/2021/10/tapas-club-jewel-review.html",,"https://res.cloudinary.com/yumssg/image/upload/c_fill,h_600,w_600/20210916_123749_tkwuov.jpg"
Pha Muk,"5001 Beach Road, #02-64 Unit D, Golden Mile Complex, Singapore 199588",Cuisine,"There are a couple of unique items on their menu, including the pinkish yen ta fo and Thai laksa with crab, the latter of which is only available on weekends. 

I was most excited to try the Yen Ta Fo ($7) here, which featured a full bowl of ingredients swimming in a pinkish broth. Completely different from the braised pork noodles, this bowl had deep-fried calamari, slices of fishcake, deep-fried wonton, cuttlefish, and green vegetables.

Fans of traditional Thai food should still come here for a taste of this dish, though, as Thai yen ta fo is a unique bowl of noodles that is rarely found in Singapore.  

Source: https://eatbook.sg/pha-muk/",,"https://res.cloudinary.com/yumssg/image/upload/c_fill,h_600,w_600/pha-muk-yen-ta-fo_mwlwou.jpg"
Whitley Road Big Prawn Noodles,"Old Airport Road Food Centre, #01-98, Blk 51 Old Airport Road, Singapore 390051",Cuisine,"Through the years, Whitley Road Prawn Noodles has been known to be one of the best prawn noodles stalls in Singapore, cooking their dishes only upon order.

They have 3 other outlets (Old Airport Road, 273 Thomson Road, 36 Circular Road) in Singapore gathering a long line of loyal followers, especially during lunch hour.

The prawns were chunky and tasted fresh - could be sweeter though; while the pork ribs were fall-off-the-bone tender.

Source: https://danielfooddiary.com/2019/03/16/whitleyroad/",,"https://res.cloudinary.com/yumssg/image/upload/c_fill,h_600,w_600/whitleyroad5_yc2n3m.jpg"
Herbal Soup,"Chinatown Food Complex, #02-017, 335 Smith Street, Singapore 050335",Cuisine,"Herbal Soup is unique in that they serve charcoal-fired herbal soups. The herbal soups were stewed for a long period of time, which made the pork ribs very tender and soft. Even though it was a small bowl, there was a generous amount of ingredients included, making it ideal as a meal by itself.

Source: https://eatbook.sg/herbal-soup/",,"https://res.cloudinary.com/yumssg/image/upload/c_fill,h_600,w_600/herbal-soup-black-chicken-soup-intro_gktct9.jpg"
Thorbaekk Grillz ,"Redhill Food Centre, #01-32, 85 Redhill Lane, Singapore 150085",Cuisine,"Their Sambal Stingray Rice Set ($9) comes with hefty slabs of stingray, a sunny side up egg, and fragrant chicken rice! The plump stingray is served beautifully charred thanks to a smokey kiss on the hot griddle.

Another must-try is their affordable Grilled Chicken Chop Rice Set ($5.50). The chicken thigh is parboiled, skin on, with ginger and lemongrass, before heading to the flaming-hot grill for a quick sear. Once again, it is embellished with the same house-made sambal sauce, atop a bed of chicken rice.

Thorbaekk Grillz is a Muslim-owned eatery.

Source: https://eatbook.sg/thorbaekk-grillz/",,"https://res.cloudinary.com/yumssg/image/upload/c_fill,h_600,w_600/thorbaekk-grillz-Sambal-Stingray-Rice-Set_b6xcwf.jpg"
Hong Kong Soya Sauce Chicken Noodles Rice,"Beauty World Food Centre, #04-48, 144 Upper Bukit Timah Rd, Singapore 588177",Cuisine,"My late grandmother made soup this way. It was full bodied and rich with depth of savoury flavours. The taste of dried cuttlefish was prominent with underlying chicken flavour.

The dumpling was all shrimp with a bit of black fungus for crunch. The good size prawns were fresh, meaty, tender-crunchy, and sweet.

The strips of beef brisket were soft, juicy, beefy and saturated with savoury flavours. The tendons were soft and smooth like floppy slippery jelly and tasted nicely savoury from the sauce enveloping it.

I was pretty mind blown by this beef brisket noodle and giant shrimp dumpling.

(Note: Beef brisket noodle available only on Sat & Sun. Shrimp dumpling available daily except Weds.)

Source: https://johorkaki.blogspot.com/2021/11/beauty-world-hong-kong-soya-sauce.html",,"https://res.cloudinary.com/yumssg/image/upload/c_fill,h_600,w_600/AVvXsEiJG4aUwWI7Yai9S2z3sZ6pt_nb3Um7R28HDkY0i15pf0fBeSQENrJ5de1CiqJtN73_7e2dwJy91Fh7EXv3V9GWW3mqLEp633OmruE9gX7vgJxTkbJVeQ0DDKcDUS9RAIlQeQyc1oEHLwPuqKPU49ECrZqRZ3kbYMYpLBQEciQ05uKeZrCn3BEQ1ulpbg_w640-h480_awd6gt.jpg"
3 Meals A Day ä¸€æ—¥ä¸‰é¤,"1 Rochor Canal Road, #02-01 Sim Lim Square, Singapore 188504",Cuisine,"This is possibly Sim Lim's best-kept food secret and hidden gem.

Other than rice dishes, there is a spread of items from noodles, bee hoon, double-boiled soups, fried rice, omelette, vegetables, to other wok-fried dishes - all affordably priced.

Source: https://danielfooddiary.com/2021/11/14/3mealsaday/",,"https://res.cloudinary.com/yumssg/image/upload/c_fill,h_600,w_600/threemealsaday8_gifzdj.jpg"
Malaysian HupKee Fishball Noodle,"158 Ang Mo Kio Ave 4, #01-590, Singapore 560158",Cuisine,"The yellow noodles we chose are coated with black sauce, lard and chilli sauce. Not very heavy on the palates despite the colour but the taste is not bad. The surprising part is that not only fishballs were bouncy but also their fishcakes and tau pok are qq as well. We were told that all of them are handmade at the stall daily.

Source: https://dairycream.blogspot.com/2021/11/malaysian-hupkee-fishball-noodle-even.html",,"https://res.cloudinary.com/yumssg/image/upload/c_fill,h_600,w_600/AVvXsEg-40oTM5HYOb6KswMprJUgYZoLecQIhtAqUajepQ7ifL5r2VBzfgl9XaMHlQwiM-PzHQGZOWQ9IQ5UNKxGVK7g63TsdB1NBFGFHRVM8eMIbKNseDJ19Xbw52RPukAPVSM2Ee-I_2N7Mtm-VKc8ihTJCYhTlkW5Z3Wl-3E-wkDkcsJymxudbVVatf6X_w598-h640_ijwvaj.jpg"
Ding Te Le,"949 Upper Serangoon Road, Singapore 534713",Cuisine,"Overall, Ding Te Le offers very good Shanghainese staple dishes. The noodles, buns and dumplings are as good as those branded restaurants, while the price is relatively cheaper. 

Source: https://www.chubbybotakkoala.com/2019/03/ding-te-le-kovan.html",,"https://res.cloudinary.com/yumssg/image/upload/c_fill,h_600,w_600/20181112_140436_fpo2tg.jpg"
Fu Lin Tou Fu Yuen ,"721 East Coast Road, Singapore 459070",Cuisine,"Unlike most yong tau foo places, Fu Lin Tou Fu Yuen does not blanch your ingredients in soup, or boiling water. Instead, they deep fry every ingredient before drizzling it with a delicious soy-based gravy which is wonderfully savoury with bits of minced meat and mushrooms.

Source: https://www.misstamchiak.com/fu-lin-tou-fu-yuen/",,"https://res.cloudinary.com/yumssg/image/upload/c_fill,h_600,w_600/48101481661_4359c4140c_h_wiafhn.jpg"
Siglap Kueh Chap,727 East Coast Road,Cuisine,"""Mr Tay proudly tells me that no one else in the whole of Singapore makes kway chap the traditional way like he does. He still pan fries the spices first before adding the braising sauce which is why the whole coffeeshop is filled with its irresistible aroma when the meat is done. The braising sauce has been kept going ever since he moved to the present location which makes it almost 30 years old!""

Source: http://ieatishootipost.sg/siglap-kway-chap-the-typical-teochew-man/",,"https://res.cloudinary.com/yumssg/image/upload/c_fill,h_600,w_600/Kway-Chap_pl1se9.jpg"
Obok Dabang,"SMU, 70 Stamford Rd, Li Ka Shing Library, #01-22A, Singapore 178901",Cuisine,"Their Korean Fried Chicken menu is only available after 5pm daily, available in either Half Chicken (7pcs $17.40) or in parts: Wings (3pcs $8.40), Drumsticks (3pcs $8.40), Tenders (4pcs $7.80).

There are two options, either one of the four different flavours: Soy Garlic, Sweet Spicy, Honey Butter Powder, Snowing Cheese or 5 different dipping sauces: Spicy Chili, Soy Garlic, Sweet Spicy, Honey Mustard and Wasabi Mayo.

Source: https://danielfooddiary.com/2021/11/13/obokdabang/",,"https://res.cloudinary.com/yumssg/image/upload/c_fill,h_600,w_600/obokdabang8_sv2yvp.jpg"
ä¹åŽ¨Alibaba Family,"2 Gambas crescent, #01-42/43 Nordcom 2, Singapore 757044",Cuisine,"Hidden jem in sembawang. The food is so good. Portion is generous too. Service staff are attentive and friendly. Highly recommended!

Source: https://www.facebook.com/groups/2773435079585801/posts/2993647587564548/",,"https://res.cloudinary.com/yumssg/image/upload/c_fill,h_600,w_600/250526735_2545361465608896_1340365356007855893_n.jpg_qilkmc.jpg"
BÃ¡nh MÃ¬ Saigon,Blk 505 Ang Mo Kio Avenue 8 #01-2668 Singapore 560505,Cuisine,"A Banh Mi that can rival the better Banh Mi in HCMC itself. This is seriously good now. IMHO the best Banh Mi in Singapore currently.

Source: https://www.facebook.com/groups/2773435079585801/posts/2993654724230501/",,"https://res.cloudinary.com/yumssg/image/upload/c_fill,h_600,w_600/253176723_10158557158631762_5536566684998450428_n.jpg_lr2ekw.jpg"
Supreme Pork Chop Rice,"67 Beach Road, Bulkhaul House, Singapore 189688",Cuisine,"Mr Hsu, a former Taiwanese basketballer, started the business with his wife in 1991. His signature dish is the pork chop - tender on the inside and crispy on the outside. He serves other dishes like chicken chop, chicken cutlet, fish & chips, and you can choose either rice, noodles, fries or a mantou (bun). 

Another dish is the Braised Pork rice and meatball soup. The Taiwan-styled meatball is handmade. 

Source: https://www.facebook.com/groups/2773435079585801/posts/2993591654236808/",,"https://res.cloudinary.com/yumssg/image/upload/c_fill,h_600,w_600/250659879_412198923751118_6065807139875875234_n.jpg_mgdnhs.jpg"
Yeh Yeh's CafÃ© by Mr Vadai,"16 Changi Road, WIS@Changi, #01-08, Singapore 419718",Cuisine,"Those familiar with pasar malam stalwarts Mr Vadai will tell you how addictive their signature deep-fried snack is.

Mr Vadai's signature prawn vadai (5 for $6) is a must-try and if you like, they also have ikan billis, vegetable, chilli, sardine and plain versions to suit every palate.

Source: https://makankakiswithdenise.wordpress.com/2021/09/16/shrimply-addictive-crispy-fluffy-prawn-vadai/",,"https://res.cloudinary.com/yumssg/image/upload/c_fill,h_600,w_600/img_8424_pk758m.jpg"
Sally Roast Meat Rice,"Northstar@AMK, 7030 Ang Mo Kio Ave 5, Singapore 569880",Cuisine,"The roast pork was crowned with a delightfully crisp crackling. While there wasn't much fat, the saltiness of the crackling balanced the flavours all out and made the sio bak very addictive. 

Source: https://www.misstamchiak.com/sally-roast-meat-rice/",,"https://res.cloudinary.com/yumssg/image/upload/c_fill,h_600,w_600/51586155372_918b536d05_o_t3cozf.jpg"
Prawn & Mee,"Pasar 216 Bedok Central #01-45, 216 Bedok North Street 1, Singapore 460216",Cuisine,"The yellow noodles were done soft tender, just right for me. The sauce was drippy wet and tasted robust (but not over the top) savoury lardy spicy with flavours coming from prawn stock, fried shallot, lard, and sambal. The taste of fried shallot seemed dominant unlike the traditional which relied more on hae bee (dried shrimp) which can be a tad salty.

I like it that the prawns were shelled. They were meaty, tender crunchy and tasted sweet in the fresh prawn way.

Source: https://johorkaki.blogspot.com/2021/10/prawn-mee-bedok-central-216-food-haven.html",,"https://res.cloudinary.com/yumssg/image/upload/c_fill,h_600,w_600/AVvXsEgsdlV1Kf2ncYMJ3iEk2shSj25SKyVsd-RiBS34PheNo9DM2IOulP-wK0olBpg1YtqLDUDWm4F96_26a0xto8PSA3vYLch1fASO7gJajghErWtgJps5CGJQStcUXTyUqCKirSUc2s2bVgWw2lafulksT4vc9-7aVEQobHqSOZ4x78FeP0Cez2ZY3kXdjg_w480-h640_dh2j1t.jpg"
Taokingu Ramen,"Blk 785E, Woodlands Rise, #01-16, Singapore 735785 ",Cuisine,"It's not too complicated of a menu, with tonkotsu being their prime choice of soup base when it comes to ramen. Take it the good ol' classic way at $6.90 or add a boost in flavour with the Red Spicy Tonkotsu Ramen ($7.90) or Black Spicy Tonkotsu Ramen ($7.90). My attention, rather, was on their fried rice variations: Egg Fried Rice ($4), Nori Fried Rice ($5) and Garlic Spicy Fried Rice ($5). 

Source: https://www.misstamchiak.com/taokingu-ramen/",,"https://res.cloudinary.com/yumssg/image/upload/c_fill,h_600,w_600/taokinguramen-4_e0kdpy.jpg"
Takeshi Noodle Bar,"Hotel Soloha, 12 Teck Lim Road, Singapore 088387",Cuisine,"We ordered the Honey Roasted Iberico Pork Ramen (S$15.90) with burnt miso iberico tonkotsu because it was touted as a must-try on Food King. We could pick the firmness of noodle (hard) and richness of tonkotsu (normal, the waitress said that's the recommended). And it was perfect. The Food King review was right, the broth was where the goodness went with a slightly sweet, smoky rich flavour that isn't overly salty and went perfectly with the noodles. The iberico pork slices themselves weren't that flavourful but you won't mind it cos it's all in the soup. Generous portion too for the price

Source: http://www.alexischeong.com/2021/10/lunch-review-takeshi-noodle-bar-at-12.html",,"https://res.cloudinary.com/yumssg/image/upload/c_fill,h_600,w_600/AVvXsEhynPYOUNX9p5MjdxeSfyGCwNnbgRrWNTkMY_VRqtXyHWWl9Lxppf9rV4iCrxyvGRmZo-YzTVKBBXQqnFyaf9PSj-1kBo2ywS8tEl9ANG1Ki2NJq2dsmB8kEkNsKWARDxshQVDFlrorzrIumfh3aGJMIef5zxKnguuTFYpazvrt0h5ejAaPkA_s16000_d4xhwt.jpg"
BEERTHAI House 1,"5001 Beach Road, #01-94/96 Golden Mile Complex, Singapore 199588",Cuisine,"No Frills, Affordable, Authentic Thai Cuisine in Little Thailand

Beerthai House was founded by chef Somsak Chomprach over 20 years ago. Chef Somsak was appointed the Thai chef for Thai Princess Maha Chakri Sirindhorn's visit to Singapore in 2009. 

I like the simple, no frills but clean environment. Efficient, sincere service. The food was delicious - the flavours and aromas were robust but well balanced. Quality of ingredients were good.

Source: https://johorkaki.blogspot.com/2021/10/beer-thai-house-no-frills-affordable.html",,"https://res.cloudinary.com/yumssg/image/upload/c_fill,h_600,w_600/AVvXsEhsSDx5Q1SYlK1-QBGBwE4t9wRiVM-F0TrwcgKKTvwYL71UhqTdoWtHFmRJnZ45qLES0dNVnmBaYje4GpHtUzl2Yw3Ppe2cnYfyZUPAJC5UiakZK9QiGQFv8h4oQwsLl5CKEJonmLZfwjbSJXb96s1eicUrPUvDfwhsCZmJWR0QJYaSDIb1m4NuWcwP7w_w640-h480_nbrj7y.jpg"
Mr Wong Seremban Beef Noodle,"Blk 929, Tampines Street 91, Singapore 520929 ",Cuisine,"Hailed as the only Seremban beef noodle stall in Singapore, Mr Wong Seremban Beef Noodle offers both soup and dry beef noodles with laksa bee hoon, regular bee hoon or la mian. There's also a very hefty-looking portion of Mixed Beef with Rice ($7) and Zhajiang Beef Noodles ($3.50) on the menu. 

Source: https://www.misstamchiak.com/mr-wong-seremban-beef-noodle/",,"https://res.cloudinary.com/yumssg/image/upload/c_fill,h_600,w_600/51618171695_4e8aab8840_o_uq9doc.jpg"
545 Whampoa Prawn Noodles,"665 Buffalo Rd, #01-326 Tekka Food Centre, Singapore 210665",Cuisine,"What I liked about the dry Prawn Noodles was combination of the spicy chilli sauce, sweet ketchup, and mixture of fried garlic and shallots which added light crisp.

The sweetness of the soup comes from the incorporation of Manilla clams, and I think some folks would appreciate this for not being too salty as well.

The stall is opened only from 7am to 11am during weekdays, and closed during the weekends.

Source: https://danielfooddiary.com/2021/10/25/545whampoaprawnnoodles/",,"https://res.cloudinary.com/yumssg/image/upload/c_fill,h_600,w_600/545prawnnoodles7_nlyqml.jpg"
Warm Up Cafe,"110 Mackenzie Road, Singapore 228708",Cuisine,"The omelette was thick, moist, almost creamy inside and generously studded with crab meat. Okay..., the meat weren't pulled out of cooked live crabs but they did have a mild crab meat sweetness and there weren't any off-taste at all.

I do enjoy the moist soft juiciness of the omelette with the soft squeaky bite of the crab meat. The egginess and mild crab sweetness complemented each other well.

Source: https://johorkaki.blogspot.com/2021/10/warm-up-cafe-hunt-for-best-thai-crab.html",,"https://res.cloudinary.com/yumssg/image/upload/c_fill,h_600,w_600/AVvXsEgv1s4h7V6FpKISSQcJdiLDxCHjX_PKgrOBjp3y6kNKru1JOjI0iDdujGd79FFqQob1_jJlkRGGuRvfMWK0N9dApEygLl_BK5R-KE_8-9jL5f6czN2XKR2XRWPVR57waqGpcdLOrhPdUVrgPCTbcv8IfNJzJFkK-JZbBTFX1EW71epJX7mm8h76tJ_38g_w436-h640_qkgce1.jpg"
Soi 47 Thai Food (Clarke Quay),"Clarke Quay Central #02-78, 6 Eu Tong Sen Street, Singapore 059817",Cuisine,"Prices are inexpensive considering this central area and air-conditioned space. A Phad Thai with Chicken is at $5.50, Basil Pork Rice with Fried Egg at $5, Tom Yum Soup with Chicken at $5.50.

Just traditional Thai ingredients to bring out the natural tastes, and prepared by Thai chefs.

Source: https://danielfooddiary.com/2021/10/26/soi47sg/",,"https://res.cloudinary.com/yumssg/image/upload/c_fill,h_600,w_600/soi47thaifood2_pmkfgj.jpg"
Craze Kitchen - Yishun,"18 Yishun Avenue 9, #01-02, Junction Nine, Singapore 768897",Cuisine,"For pasta, the best-selling Chicken Aglio Olio ($10) is a must-try with its juicy portion of grilled chicken steak.

If you are looking for a creamy-type pasta, order the Cream Carbonara ($10) and try it with a battered fish fillet for a lighter-kind-of-meat.

Source: https://danielfooddiary.com/2021/10/27/crazekitchen/",,"https://res.cloudinary.com/yumssg/image/upload/c_fill,h_600,w_600/crazekitchen9_jv2vun.jpg"
